{
  "name": "SH2-157_LRGB_Summer2024",
  "type": "LRGB",
  "calibration": {
    "bias": "2024_08_10",
    "darks": "2025_01_23",
    "flats": "2024_08_09"
  },
  "lights": {
    "L": [
      "SH2-157/2024_08_28/L180"
    ],
    "R": [
      "SH2-157/2024_08_28/R300"
    ],
    "G": [
      "SH2-157/2024_08_28/G300"
    ],
    "B": [
      "SH2-157/2024_08_28/B300"
    ]
  },
  "options": {
    "flip_calibration_vertical": true,
    "dark_temp_override": -10,
    "veralux_starcomposer_log_d": 0.1
  }
}
