{
  "name": "NGC4244_Winter2025",
  "type": "LRGB",
  "calibration": {
    "bias": "2024_08_10",
    "darks": "2025_01_23",
    "flats": "2025_01_19"
  },
  "lights": {
    "L": [
      "NGC4244/2025_01_26/L180",
      "NGC4244/2025_01_27/L180",
      "NGC4244/2025_01_28/L180",
      "NGC4244/2025_01_29/L180"
    ],
    "R": [
      "NGC4244/2025_01_26/R180",
      "NGC4244/2025_01_27/R180"
    ],
    "G": [
      "NGC4244/2025_01_26/G180"
    ],
    "B": [
      "NGC4244/2025_01_26/B180"
    ]
  },
  "options": {
    "flip_calibration_vertical": true,
    "dark_temp_override": -10,
    "veralux_target_median": 0.10,
    "autostretch_targetbg": 0.10,
    "autostretch_mtf_low": 0.0,
    "autostretch_mtf_mid": 0.48,
    "autostretch_mtf_high": 0.70
  }
}
