{
  "name": "NGC2175_Winter2025",
  "type": "SHO",
  "calibration": {
    "bias": "2024_08_10",
    "darks": "2025_01_23",
    "flats": "2025_01_19"
  },
  "lights": {
    "S": [
      "NGC2175/2025_01_17/S180",
      "NGC2175/2025_01_21/S180",
      "NGC2175/2025_01_22/S180",
      "NGC2175/2025_01_27/S180",
      "NGC2175/2025_01_28/S180"
    ],
    "H": [
      "NGC2175/2025_01_17/H180",
      "NGC2175/2025_01_21/H180",
      "NGC2175/2025_01_22/H180",
      "NGC2175/2025_01_27/H180",
      "NGC2175/2025_01_28/H180"
    ],
    "O": [
      "NGC2175/2025_01_17/O180",
      "NGC2175/2025_01_21/O180",
      "NGC2175/2025_01_28/O180"
    ]
  },
  "options": {
    "flip_calibration_vertical": true,
    "dark_temp_override": -10,
    "palette": "SHO",
    "pre_stack_subsky_method": "none",
    "post_stack_subsky_method": "poly",
    "narrowband_neutralization": true,
    "autostretch_targetbg": 0.12,
    "autostretch_mtf_low": 0.0,
    "autostretch_mtf_mid": 0.60,
    "autostretch_mtf_high": 0.95
  }
}
