{
  "name": "IC1396_Fall2024",
  "type": "SHO",
  "calibration": {
    "bias": "2024_08_10",
    "darks": "2025_01_23",
    "flats": "2025_01_19"
  },
  "lights": {
    "S": [
      "IC1396/2024_09_24/S300"
    ],
    "H": [
      "IC1396/2024_09_24/H300"
    ],
    "O": [
      "IC1396/2024_09_24/O300"
    ],
    "L": [
      "IC1396/2024_09_24/L300"
    ]
  },
  "options": {
    "flip_calibration_vertical": true,
    "dark_temp_override": -10,
    "palette": "SHO",
    "autostretch_targetbg": 0.05,
    "autostretch_mtf_low": 0.04,
    "autostretch_mtf_mid": 0.25,
    "autostretch_mtf_high": 0.3
  }
}
