{
  "name": "SH2-184_Fall2024",
  "type": "LSHO",
  "calibration": {
    "bias": "2024_08_10",
    "darks": "2025_01_23",
    "flats": "2025_01_19"
  },
  "lights": {
    "L": [
      "SH2-184/2024_09_29/L300"
    ],
    "S": [
      "SH2-184/2024_09_29/S300"
    ],
    "H": [
      "SH2-184/2024_09_29/H300"
    ],
    "O": [
      "SH2-184/2024_09_29/O300"
    ]
  },
  "options": {
    "flip_calibration_vertical": true,
    "dark_temp_override": -10,
    "palette": "SHO",
    "narrowband_neutralization": false,
    "autostretch_targetbg": 0.10,
    "autostretch_mtf_low": 0.04,
    "autostretch_mtf_mid": 0.50,
    "autostretch_mtf_high": 0.80
  }
}
