{
  "name": "M31_Fall2024",
  "type": "LRGB",
  "calibration": {
    "bias": "2024_08_05",
    "darks": "2025_01_23",
    "flats": "2025_01_19"
  },
  "lights": {
    "L": [
      "M31/2024_10_05/L180",
      "M31/2024_11_06/L180",
      "M31/2024_11_07/L180"
    ],
    "R": [
      "M31/2024_10_05/R180",
      "M31/2024_11_06/R180",
      "M31/2024_11_07/R180"
    ],
    "G": [
      "M31/2024_10_05/G180",
      "M31/2024_11_06/G180",
      "M31/2024_11_07/G180"
    ],
    "B": [
      "M31/2024_10_05/B180",
      "M31/2024_11_06/B180",
      "M31/2024_11_07/B180"
    ]
  },
  "options": {
    "flip_calibration_vertical": true,
    "saturation_amount": 0.15,
    "dark_temp_override": -10,
    "stretch_method": "veralux",
    "stretch_compare": true,
    "deconv_enabled": true,
    "spcc_enabled": true,
    "veralux_silentium_enabled": true,
    "veralux_revela_enabled": true,
    "veralux_vectra_enabled": true,
    "starnet_enabled": false,
    "diagnostic_previews": true,
    "post_stack_subsky_method": "poly",
    "post_stack_subsky_degree": 2,
    "autostretch_mtf_low": 0.0,
    "autostretch_mtf_mid": 0.6,
    "autostretch_mtf_high": 1.0
  }
}