{
  "name": "IC443_Dec2024",
  "type": "SHO",
  "calibration": {
    "bias": "2024_08_05",
    "darks": "2025_01_23",
    "flats": "2025_01_19"
  },
  "lights": {
    "S": [
      "IC443/2024_11_30/S180",
      "IC443/2024_12_01/S180",
      "IC443/2024_12_02/S180"
    ],
    "H": [
      "IC443/2024_12_02/H180"
    ],
    "O": [
      "IC443/2024_12_02/O180"
    ]
  },
  "options": {
    "flip_calibration_vertical": true,
    "palette": "SHO",
    "dark_temp_override": -10,
    "pre_stack_subsky_method": "none",
    "autostretch_linked": false,
    "autostretch_targetbg": 0.08,
    "autostretch_mtf_low": 0.02,
    "autostretch_mtf_mid": 0.35,
    "autostretch_mtf_high": 0.5
  }
}
