{
  "name": "M45_Winter2025",
  "type": "LRGB",
  "calibration": {
    "bias": "2024_08_10",
    "darks": "2025_01_23",
    "flats": "2025_01_19"
  },
  "lights": {
    "L": [
      "M45/2024_09_24/L300",
      "M45/2025_01_18/L180"
    ],
    "R": [
      "M45/2024_09_24/R300",
      "M45/2025_01_18/R180"
    ],
    "G": [
      "M45/2024_09_24/G300",
      "M45/2025_01_18/G180"
    ],
    "B": [
      "M45/2024_09_24/B300",
      "M45/2025_01_18/B180"
    ]
  },
  "options": {
    "flip_calibration_vertical": true,
    "dark_temp_override": -10,
    "saturation_amount": 0.25,
    "stretch_compare": true,
    "deconv_enabled": false,
    "spcc_enabled": true,
    "veralux_silentium_enabled": false,
    "veralux_revela_enabled": false,
    "veralux_vectra_enabled": false,
    "starnet_enabled": false,
    "diagnostic_previews": true,
    "post_stack_subsky_method": "poly",
    "post_stack_subsky_degree": 2,
    "autostretch_targetbg": 0.10,
    "autostretch_mtf_low": 0.0,
    "autostretch_mtf_mid": 0.52,
    "autostretch_mtf_high": 0.90
  }
}
