{
  "name": "SH2-190_Fall2024",
  "type": "LSHO",
  "calibration": {
    "bias": "2024_08_10",
    "darks": "2025_01_23",
    "flats": "2025_01_19"
  },
  "lights": {
    "L": [
      "SH2-190/2024_09_27/L300",
      "SH2-190/2024_09_30/L180",
      "SH2-190/2024_10_01/L180",
      "SH2-190/2024_10_02/L180"
    ],
    "S": [
      "SH2-190/2024_09_30/S180",
      "SH2-190/2024_10_01/S180",
      "SH2-190/2024_10_02/S180"
    ],
    "H": [
      "SH2-190/2024_09_27/H300",
      "SH2-190/2024_10_01/H180",
      "SH2-190/2024_10_02/H180"
    ],
    "O": [
      "SH2-190/2024_10_02/O180"
    ]
  },
  "options": {
    "flip_calibration_vertical": true,
    "narrowband_neutralization": false,
    "dark_temp_override": -10,
    "palette": "SHO",
    "autostretch_targetbg": 0.08,
    "autostretch_mtf_low": 0.02,
    "autostretch_mtf_mid": 0.35,
    "autostretch_mtf_high": 0.5
  }
}
