{
  "name": "M33_Dec2024",
  "type": "LRGB",
  "calibration": {
    "bias": "2024_08_05",
    "darks": "2025_01_23",
    "flats": "2025_01_19"
  },
  "lights": {
    "L": [
      "M33/2024_11_29/L180",
      "M33/2024_11_30/L180",
      "M33/2024_12_01/L180",
      "M33/2024_12_02/L180"
    ],
    "R": [
      "M33/2024_11_30/R180",
      "M33/2024_12_01/R180",
      "M33/2024_12_02/R180"
    ],
    "G": [
      "M33/2024_11_30/G180",
      "M33/2024_12_01/G180",
      "M33/2024_12_02/G180"
    ],
    "B": [
      "M33/2024_11_30/B180",
      "M33/2024_12_01/B180",
      "M33/2024_12_02/B180"
    ]
  },
  "options": {
    "flip_calibration_vertical": true,
    "dark_temp_override": -10,
    "veralux_target_median": 0.10,
    "veralux_b": 4.0,
    "saturation_amount": 0.75,
    "post_stack_subsky_degree": 1,
    "autostretch_targetbg": 0.10,
    "autostretch_mtf_low": 0.0,
    "autostretch_mtf_mid": 0.47,
    "autostretch_mtf_high": 0.78
  }
}
