{
  "name": "LDN1082_Fall2024",
  "type": "LRGB",
  "calibration": {
    "bias": "2024_08_10",
    "darks": "2025_01_23",
    "flats": "2025_01_19"
  },
  "lights": {
    "L": [
      "LDN1082/2024_09_30/L180",
      "LDN1082/2024_10_01/L180",
      "LDN1082/2024_10_02/L180"
    ],
    "R": [
      "LDN1082/2024_09_30/R180",
      "LDN1082/2024_10_01/R180",
      "LDN1082/2024_10_02/R180"
    ],
    "G": [
      "LDN1082/2024_09_30/G180",
      "LDN1082/2024_10_01/G180",
      "LDN1082/2024_10_02/G180"
    ],
    "B": [
      "LDN1082/2024_09_30/B180",
      "LDN1082/2024_10_01/B180",
      "LDN1082/2024_10_02/B180"
    ]
  },
  "options": {
    "flip_calibration_vertical": true,
    "autostretch_targetbg": 0.10,
    "autostretch_mtf_low": 0.0,
    "autostretch_mtf_mid": 0.47,
    "autostretch_mtf_high": 0.72
  }
}
