{
  "name": "SH2-103_Fall2024",
  "type": "LHOO",
  "calibration": {
    "bias": "2024_08_10",
    "darks": "2025_01_23",
    "flats": "2025_01_19"
  },
  "lights": {
    "L": [
      "SH2-103/2024_09_26/L300",
      "SH2-103/2024_09_27/L300",
      "SH2-103/2024_09_29/L300"
    ],
    "H": [
      "SH2-103/2024_09_26/H300",
      "SH2-103/2024_09_27/H300",
      "SH2-103/2024_09_29/H300"
    ],
    "O": [
      "SH2-103/2024_09_26/O300",
      "SH2-103/2024_09_27/O300",
      "SH2-103/2024_09_29/O300"
    ]
  },
  "options": {
    "flip_calibration_vertical": true,
    "narrowband_neutralization": false,
    "dark_temp_override": -10,
    "palette": "HOO",
    "autostretch_targetbg": 0.08,
    "autostretch_mtf_low": 0.02,
    "autostretch_mtf_mid": 0.38,
    "autostretch_mtf_high": 0.55
  }
}
