{
  "name": "NGC7000_Fall2024",
  "type": "LRGB",
  "calibration": {
    "bias": "2024_08_10",
    "darks": "2025_01_23",
    "flats": "2025_01_19"
  },
  "lights": {
    "L": [
      "NGC7000/2024_09_03/L180"
    ],
    "R": [
      "NGC7000/2024_09_03/R180"
    ],
    "G": [
      "NGC7000/2024_09_03/G180"
    ],
    "B": [
      "NGC7000/2024_09_03/B180"
    ],
    "Ha": [
      "NGC7000/2024_09_03/H300"
    ]
  },
  "options": {
    "flip_calibration_vertical": true,
    "dark_temp_override": -10,
    "autostretch_targetbg": 0.10,
    "autostretch_mtf_low": 0.0,
    "autostretch_mtf_mid": 0.48,
    "autostretch_mtf_high": 0.78
  }
}
